Rank	Frequency	UUID	Row Text
1681	1	4bfa-70f5-4c5f-1484	white blood cell destroys pathogens in the body
1682	1	cd15-3f60-6ecd-86dd	warm-weather organisms live in warm climates
1683	1	55b0-655c-6c67-2cf5	a paper bag is a kind of object
1684	1	7e98-a3e5-b8ca-8603	hollow bones are lighter in weight
1685	1	625d-d91e-b300-b6dc	lizards eat insects
1686	1	ccee-6dfb-1111-b7a2	as the number of eggs laid by an animal increases , the number of eggs that hatch will increase
1687	1	2030-ad1d-a83f-6581	an ocean is a source of heat and moisture for a hurricane
1688	1	45f8-aa77-a322-62d5	a rubber eraser is made of rubber
1689	1	aa69-b4c1-b1e1-9000	a natural resource is a kind of environmental factor
1690	1	6fc4-8091-f720-3e33	a measurement is a kind of data
1691	1	0c8a-25b8-b161-eab3	a molecule is exceptionally small in size
1692	1	c3ed-2a60-a3c3-a504	slipping is a kind of motion
1693	1	6384-7501-43b6-e41a	when an electrical circuit is working properly , electrical current runs through that circuit ; the wires in that circuit
1694	1	2c2b-310a-0ee6-e4a2	a tree growing a tree-growth ring occurs once per year
1695	1	aadc-bc4f-81be-06ac	An example of playing a musical instrument is hitting the keys of a piano
1696	1	986b-2bb0-3244-7133	Leo is a kind of constellation
1697	1	b376-a3d3-5d2e-8fd9	a new season occurs once per three months
1698	1	8854-3e45-f39e-81a8	left out of means moved from
1699	1	7cee-45d4-aa3a-ca19	a simple machine is a kind of tool
1700	1	7ffb-2fbf-9c6a-7f2a	railroad tracks are a kind of object
1701	1	3227-54bb-37d3-16c8	scales are found on the skin of scaled animals
1702	1	0781-1abe-a590-378c	skidding causes friction
1703	1	7896-0ee6-9c3c-f3c1	water vapor is found in the atmosphere
1704	1	c6d0-b0ba-ba3b-db1c	a hit is a kind of touch
1705	1	140f-03da-a4ce-9f45	colorless means no color
1706	1	2fd8-2d03-ccfe-ca27	decomposition increases amount of organic matter in soil
1707	1	81c7-3170-da45-e21d	the Himalayas are a kind of mountain range
1708	1	3836-b248-bdff-be59	an ocean contains waves
1709	1	40c7-9325-944b-d06d	a mammal usually nurses its young ; its offspring
1710	1	ea47-0dd8-dfeb-ca80	solids are usually hard
1711	1	969d-a910-8943-e775	usually coral lives in warm water
1712	1	4fd1-9865-f350-6e2c	a grassland is a kind of environment
1713	1	87f9-3bab-fa6f-f24c	skin is the first ; outermost layer around the body of some animals
1714	1	f249-a34c-12c4-3aa1	a flower 's petals often are bright in color to attract pollinators
1715	1	94b4-900e-1eec-d6c3	as the temperature of something increases , the intensive properties of that something will not change
1716	1	cc97-f39d-361d-3f59	if someone is standing away from something then that someone is not touching that something
1717	1	fcf8-5a39-4b2d-ece2	a coast is a kind of environment
1718	1	73ef-3026-389a-20a2	pencil lead contains mineral graphite
1719	1	c31f-f938-8a69-233b	food is a kind of substance
1720	1	539c-ccfe-688f-27f6	to transform means to convert
1721	1	e303-f8e1-4293-664d	a physicist studies energy
1722	1	4043-728e-19d8-238d	bringing oxygen to the body is a kind of function
1723	1	f542-77fe-59a4-e55f	good bacteria have a positive impact on a living thing 's survival ; health
1724	1	55b1-c3f1-bdb8-826d	a cat is a kind of mammal
1725	1	738a-36ed-7284-dfa2	sidewalk means pavement
1726	1	1c37-9df2-350b-3c5a	room contains walls
1727	1	0f02-bd0a-c36c-0bbc	to store means to hold
1728	1	d55d-1df7-94a7-708c	using less resources usually causes money to be saved
1729	1	3f9b-f0b8-3284-7aca	a pail is a kind of container
1730	1	d5fc-0707-ab28-947f	shelter is used for protection by animals against weather
1731	1	b043-79cc-a77e-e968	chemical energy is a kind of energy
1732	1	14dd-cb36-7a17-38fa	An example of avoiding waste is using an object ; a material more than once
1733	1	875c-ebc8-05a0-0a18	An example of an adaptation is camel humps
1734	1	01ce-5c8d-152d-6464	to discover means to make a discovery
1735	1	05d2-d1e3-489a-8716	warm is similar to hot
1736	1	5c25-2129-40a6-71ea	to reproduce means to have offspring
1737	1	1631-78fe-2811-ffb9	a squid produces thrust by pushing water out of its body
1738	1	33fe-9382-75a8-9316	if a tree is located near a sidewalk then the roots of that tree might crack the sidewalk
1739	1	8969-68e2-987a-8b72	contract is a kind of change in volume
1740	1	2bcd-053b-16f1-66e2	concrete is usually a smooth surface
1741	1	c72d-59a5-2ef3-0271	hair ; fur is a part of skin for protection ; keeping warm
1742	1	7056-db73-6d86-2bf1	the Alps are a kind of mountain range
1743	1	de85-5c79-0f87-2066	speaking is a kind of communication
1744	1	d36c-a9f0-2f37-c0e1	plants are a source of fibers
1745	1	8d5f-c046-b209-66c3	if two animals live in different environments then those two animals will have different food sources
1746	1	1fa0-bd7e-3b50-b250	a pollutions standard is a kind of standard for reducing pollutants emitted by vehicles ; by factories
1747	1	945f-acde-29f3-d573	a hot plate is a source of heat
1748	1	a31e-1af6-3adc-a0b4	to get hot means become hot
1749	1	3885-322a-8509-b74c	color is an intensive property
1750	1	bbef-5cd8-4316-7358	preparing for a storm requires predicting the occurrence of that storm
1751	1	2a84-8168-a68d-adac	if an organism becomes too hot then that organism may die
1752	1	887f-3af4-3e07-807d	a candle is a source of light when it is burned
1753	1	5e45-653c-e6dc-6c95	a worm has a tube-like body
1754	1	86d3-723e-62b0-6dfa	to repair means to heal
1755	1	994f-4898-9a1a-659b	as distance to an object increases , that object will appear smaller
1756	1	c98e-3a98-2020-c736	an inclined plane is used for raising ; lowering objects
1757	1	a0b0-3334-1d94-6318	as the force with which an object is touched increases , the amount of mechanical energy converted to sound energy will increase
1758	1	8e1c-a4f8-3938-b891	a brain is a kind of internal organ
1759	1	8f95-5431-bea6-4649	a sharp sense is an enhanced sense
1760	1	e9d9-325b-c54c-5f88	movement is a kind of change
1761	1	5a57-e1e0-4c65-262d	to put on means to wear
1762	1	6ed2-789b-e3f7-91fa	opacity is a property of an object and includes ordered values of opaque ; translucent ; transparent
1763	1	b614-101e-c03f-d0d0	if an event is required for a process then that event must occur before that process can occur
1764	1	405a-72ae-da94-0c7d	a load of bricks is a kind of object
1765	1	336b-8580-1de1-5714	taking in something means acquiring that something
1766	1	9863-d20e-e589-510a	an atom is a kind of object
1767	1	b872-e845-39f5-5b25	carbon dioxide is colorless
1768	1	d042-a628-d170-532f	flying a kite requires wind
1769	1	9727-5f85-da9b-f759	a wolf is a kind of animal
1770	1	7697-a428-b299-c144	a function is a kind of characteristic
1771	1	d9fd-c8f3-a4aa-801e	as an object descends into water , the pressure on that object will increase
1772	1	57fc-8994-cc18-9090	expand is a kind of change in volume
1773	1	6a9e-f4d8-755c-81d3	if a habitat can no longer support animals then those animals will move to another area
1774	1	3f9d-3d9c-0d39-6b31	little means small
1775	1	3fd7-d689-6b35-21ac	natural magnetism is used for pointing north by a compass
1776	1	409a-a89f-e238-2bac	shape is a kind of characteristic
1777	1	2d70-c601-74c1-0594	medicine is used for curing people when they are sick
1778	1	89d4-504e-26ea-25da	refrigerators contain harmful chemicals
1779	1	3e73-bd8b-3ffb-d9d4	the Appalachians were formed by rock folding
1780	1	e1be-4636-b374-a6c2	leaves changing color occurs when seasons change
1781	1	1fc6-7784-ccd9-4fd5	expand means increase in size
1782	1	95aa-008a-1446-db3b	if something does not move then that something can be found in the same location
1783	1	aa86-c090-3f89-1a5d	In the food chain process bacteria have the role of decomposer
1784	1	3ed3-ffdd-5807-f126	a hummingbird is a kind of bird
1785	1	599e-347c-567c-1fb2	as mileage per galon of gasoline increases , the amount of gasoline used will decrease
1786	1	7f2c-ec1b-0791-4c0d	an inclined plane is a kind of simple machine
1787	1	1e9c-bb95-3934-82d2	mass ; weight is an extensive property
1788	1	a99c-e41a-2a2b-ad6b	ringing is a kind of function of a doorbell
1789	1	e069-66e7-52de-03e7	blubber is often a part of sea mammals for keeping warm by providing thermal insulation
1790	1	75ad-f2bb-fa6b-12cc	Ohio is a state located in the United States of America
1791	1	ef29-744a-92a8-f884	solar radiation means solar energy
1792	1	555d-d839-0a6b-4a52	bark is a part of a tree
1793	1	b39a-5a6f-9af1-b3de	baking soda can react chemically with vinegar
1794	1	3711-f792-5151-2c3a	usual means does not vary much
1795	1	3599-03b4-9c23-4b8f	toward is a kind of direction
1796	1	818d-694a-356a-68bb	erosion is a kind of destructive force
1797	1	ab88-7ab1-d6b7-0e6c	a marsh willow herb is a kind of plant
1798	1	37af-5fb1-9a80-3548	amphibians hatch from eggs
1799	1	3823-1fac-a50b-665f	weathering ; erosion usually occurs over a period of many years
1800	1	9f96-8d81-abd0-2bc1	fur is a part of a mouse
1801	1	8726-c09d-4a3b-e814	to restore means to return to a better state
1802	1	26d4-7eb1-9874-3e50	xylem transports materials through the plant
1803	1	bb76-5bf9-7c9a-e096	condition is a property of an environment
1804	1	0f8a-4ede-42d6-258e	a multicellular organism has more than one cell
1805	1	b569-cef5-65a2-2a57	noise means sound
1806	1	e6a3-b433-9d25-fd98	to change means to have an effect
1807	1	9430-e769-9be8-f995	light rays can have a negative impact on the eyes
1808	1	72a4-c6f3-e68c-7836	bacteria can cause people to become ill
1809	1	8627-a51d-fcbc-8601	moving is similar to travelling
1810	1	af1a-348d-eec7-2eb8	soda is a kind of beverage
1811	1	635e-4c5d-98ab-31af	strength is a property of an object ; a material
1812	1	123c-6e70-ccd0-1f3d	microorganisms cause food to spoil
1813	1	adb3-8ad7-befa-74c9	zoo exhibits should contain all things required by the animals living in those exhibits
1814	1	b31b-67cf-066a-859c	a property is a kind of information
1815	1	aea0-195f-c237-c935	a bone is a part of some animals
1816	1	27ac-0696-3449-6bd2	when the seasons change from the summer to the fall , the amount of daylight will decrease
1817	1	56ab-4514-2109-0942	a pathway is a kind of plane
1818	1	0499-a475-56c4-8d43	a crab is a kind of water animal
1819	1	7f3b-9182-504a-0463	a western coral snake is poisonous
1820	1	593d-3e3b-bb10-5476	a shelter is used for living in by animals
1821	1	67b1-cfae-5a8e-a28c	dimmer is the opposite of brighter
1822	1	2729-44c9-6c43-99ee	a canyon forming occurs over a period of millions of years
1823	1	8867-690e-1dfa-c7b4	An example of a fossil is a paw print in rock
1824	1	1a38-d031-a283-b5aa	carbon monoxide is a kind of gas
1825	1	b906-1552-b7cb-0be1	tea is a kind of beverage
1826	1	a7f1-5498-c4dd-7392	usually craters on planets ; craters on moons are formed by asteroids ; meteoroids impacting that planet or moon 's surface
1827	1	2db1-ab10-ff6c-cc17	sulfur is yellow in color
1828	1	3be9-54e5-8748-516c	melting point can be used to identify a pure substance
1829	1	b20b-f9ca-a6c1-68e6	a wildfire is a kind of natural disaster
1830	1	4916-08e1-51ef-8c63	an object acting against a force can cause that object to move in the opposite direction
1831	1	5c20-2524-068f-74f6	breaking down is a kind of function
1832	1	a67b-fecc-2c14-cefb	a rough surface is a part of sandpaper
1833	1	5db9-95b3-3826-14c0	milk is a kind of food
1834	1	311e-8d88-cde2-860d	a bush is a kind of plant
1835	1	d709-d70e-7d0f-3f54	glass is a kind of object
1836	1	02a9-6ebd-741c-ddf1	an ear is a kind of body part
1837	1	a453-a164-a836-a893	to classify means to decide what class something belongs to
1838	1	1761-802d-4af8-c594	if an object is blue then that object reflects only blue light
1839	1	4184-5780-8914-8264	animal cells can not perform photosynthesis
1840	1	bf2e-54e3-170e-d241	if an animal 's skin is a certain color then that animal is that color
1841	1	d97c-35a6-227e-6198	offspring are a part of a generation
1842	1	1548-3b52-24c7-3f2d	a nose is a part of a body
1843	1	5e8b-5290-a9f9-d771	dairy is a source of Vitamin D
1844	1	39b7-6128-a6ae-5d97	mixing is a kind of activity
1845	1	f58b-3497-96ff-eec1	flowing is similar to pouring
1846	1	a603-7574-10cf-966e	drought may cause wildfires
1847	1	f390-e545-13bc-42de	as heat and moisture increases , the strength of a hurricane will increase
1848	1	309f-f563-d657-27c8	the head is a part of an animal
1849	1	6f96-bf9c-7fa5-2340	thermal gloves are a kind of safety gear
1850	1	1946-b43f-82d5-547d	rubber is a kind of material
1851	1	06f5-8cbc-7ae5-111f	plastic is a nonrenewable resource
1852	1	292e-d25a-73fe-1e95	live birth means developing inside the mother instead of an egg
1853	1	42d5-c036-5d21-b206	to anchor means to provide support
1854	1	052f-26fc-455b-c202	refraction causes something to appear ; to look different
1855	1	3625-df10-23fc-2223	bike means bicycle
1856	1	0ed7-324f-5c82-eb6c	the melting point of oxygen is -361.8F ; -218.8C ; 54.4K
1857	1	cdba-a39e-8a33-7324	nerves are made of nerve cells
1858	1	76c8-6933-622a-64f6	humans eat crops
1859	1	9895-ba65-e45d-613f	needing something means depending on that something
1860	1	2a06-2a73-ddc5-b6c8	to touch means to contact
1861	1	c7cf-6501-ed06-6b76	as the amount of polluting gasses in the atmoshere increases , the atmospheric temperature will increase
1862	1	774b-6b2d-30c6-71c0	explosions can cause harm to an organism
1863	1	be7f-0242-d76f-3be0	smooth is a kind of texture
1864	1	7560-5c0d-bc49-026c	preventing the transfer of heat from an organims 's body causes that organism to keep warm
1865	1	892b-d4f7-9599-791b	a water tower is a kind of habitat for birds
1866	1	0902-751a-e13d-ac41	washing out means being moved from by water
1867	1	f484-95d0-af56-d834	reproduction is when an organism passes genetic information from itself to its offspring
1868	1	3e57-14d2-b5aa-9c07	electrical current running through a wire causes that wire to heat up ; to become warm
1869	1	1c57-e18b-f776-c5eb	deep sea animals live deep in the ocean
1870	1	5f16-d62c-3e05-6719	streak is a measure of the color of a mineral below the surface or as a powder
1871	1	50d7-9492-5143-d88b	to pass means to occur
1872	1	3c9d-e904-586a-2a9d	a closed circuit has continuous path
1873	1	b3e6-7562-a0b7-db2a	indented means a little deep in depth
1874	1	aa44-693c-697b-f10c	stalactites are formed by deposition
1875	1	b7e0-eb77-1c54-4642	if an animal is trained to do something then that something is a learned behavior
1876	1	6d05-237f-42f2-6589	Boston is city that is near to the coast of the Atlantic Ocean
1877	1	1d01-8937-52ac-d9af	An example of playing a musical instrument is strumming a guitar string
1878	1	e6a9-507a-d37b-db63	In the tree reproduction process a squirrel has the role of seed disperser
1879	1	217b-abe7-6613-655c	a nest is used for protecting young by birds
1880	1	5ebf-99ed-deef-f31d	formation of a state of matter is a kind of process
1881	1	32b9-45a7-7e74-12c2	to be dependent on something means to depend on that something
1882	1	163a-1ae9-b8d6-c3ab	as the population of plants decreases , carbon in the atmosphere will increase
1883	1	4eea-4745-39cb-2779	a microorganism is a part of a compost pile
1884	1	1d87-acba-1519-cd97	a mouse births ; gives birth to live young
1885	1	ce92-ccfe-ccdf-061f	a tripe in a vehicle requires using that vehicle
1886	1	24c0-2337-1514-44da	leaves are sometimes brown in color
1887	1	3031-35f3-a6f5-2fe0	long ears are used for releasing heat by a jackrabbit
1888	1	4539-85f1-57c0-5e89	a region is a kind of location
1889	1	7dcd-a12c-54b1-a787	crops ; farming cause nutrients in the soil to decrease
1890	1	f653-454d-6b95-5714	the small intestine is a part of the digestive system
1891	1	d49f-dde6-0083-0a5b	steel is a kind of metal
1892	1	2806-8957-c846-253b	oil is a kind of substance
1893	1	9acd-957d-4cb7-9725	plant and animal matter means organic matter
1894	1	5319-76bf-8c5d-657d	a cricket is a kind of insect
1895	1	2b70-ecb7-15fb-441c	tectonic plates being pushed together causes earthquakes
1896	1	16da-5361-a2eb-9264	sunny is a kind of weather
1897	1	06bb-097d-8689-544f	a claw is often part of a bird
1898	1	523a-4a3c-c4a9-e681	as competition for resources decreases , the ability to compete for resources will increase
1899	1	462f-0e75-97ec-060c	a renewable resource is a natural resource
1900	1	20bd-0367-a504-562b	a compass is used for determining direction
1901	1	5c21-873c-7d14-83ef	an organism breaking down sugar is a source of carbon dioxide ; water
1902	1	f928-890b-c601-7e5a	as the amount of daylight increases , sunset will occur later in the day
1903	1	524f-527c-c377-46c0	as the weight of an animal decreases , that animal will fly more easily
1904	1	acb4-aae4-4bf6-25e0	a mountain chorus frog is a kind of frog
1905	1	aa4b-35f5-0dc1-afbe	a brain is a part of an animal
1906	1	0fc7-bb62-bc30-e3fd	slate is a kind of metamorphic rock
1907	1	5611-cf44-6cd6-2aed	bacteria ; viruses cause food poisoning
1908	1	2f61-1e65-c812-3feb	a glacier causes mechanical weathering
1909	1	a33f-4863-f3b8-8871	tinted lenses are a part of sunglasses for protecting the eyes by reflecting light
1910	1	911e-1d6c-cbba-c371	a television can be used for communication
1911	1	f58a-4d4f-e0ae-6833	building something often requires measuring the materials
1912	1	0025-3e37-acf0-467a	laboratory apron ; laboratory coat is a kind of safety gear for protecting a person during an experiment
1913	1	38f7-b1e7-b37e-ef1e	to carry means to move something
1914	1	4581-6e67-e838-1ec2	warm-blooded is the opposite of cold-blooded
1915	1	8731-96ec-1a7b-d0c9	magnetic force means magnetism
1916	1	6526-d3de-375a-2661	An example of combining two substances is pouring one substance into the other substance
1917	1	bfe6-d06b-d8bf-a2c1	trees of different species have differently shaped leaves
1918	1	959a-ab9a-2217-9fac	if one electrical conductor contacts another electrical conductor then electricity will flow through both conductors
1919	1	d6ad-b5b4-1186-0117	a container with air holes in the top is a kind of tool
1920	1	2dc8-0f5e-7f78-4dce	tidal energy can be used to produce electricity
1921	1	486b-5779-6446-5a7c	abundant means high in number
1922	1	9d1d-a854-c8ac-a4db	an electric car contains an electric motor
1923	1	fb92-b17a-c650-08cf	rainstorm means rain storm
1924	1	d8c7-06a7-c7ec-8653	an equinox occurs twice per year
1925	1	2c00-a6e8-2894-a55a	if something gains something from something else then that something else is a source of that something
1926	1	e3cb-84d0-f086-f8b8	a finger is a part of a hand
1927	1	9381-2aee-2b0c-d21c	magnetism is a kind of force
1928	1	ee54-4b39-996f-44ce	the moon is less bright than the sun
1929	1	1932-0d7e-562c-c466	a coyote is a kind of animal
1930	1	157e-8f35-f478-8797	finding something means locating that something
1931	1	74d9-e91b-c38a-b5d2	riding is a kind of motion
1932	1	4a43-1f50-d613-de3e	a swimming pool contains water
1933	1	213d-225f-ebb9-d228	function is similar to purpose
1934	1	9486-6e1f-f8b7-e8b8	furniture often is made of wood
1935	1	c25b-67c9-2d33-9116	carnivores ; omnivores are predators
1936	1	2223-80a8-8d8c-0183	a stout beardfish is a kind of fish
1937	1	ae2c-3485-b503-7d22	scales are a covering around the body of a scaled animal
1938	1	010c-39f3-1b7a-7408	a car moves on a road
1939	1	89ff-54de-77cf-9d13	a tape measure is a kind of tool for measuring distance ; measuring length
1940	1	30cb-93b0-59c3-f2e0	removing dead organisms from an ecosystem causes available nutrients to be removed from that ecosystem
1941	1	49e4-dd5f-a48b-76cc	rocks sometimes contain iron
1942	1	8f77-75b9-8616-35c0	a stinger is a part of a wasp
1943	1	4da2-ef1d-0184-bd32	a thorn is a part of some plants
1944	1	544b-b9d9-1ef5-42c4	polar bears live in cold environments
1945	1	c408-fd09-500e-0867	exercise is a kind of physical activity
1946	1	7955-b33e-9357-33b7	identifying is similar to determining
1947	1	86c9-9f73-ea5d-79fd	as available water in an environment decreases , the amount of available food in that environment will decrease
1948	1	3470-556f-94c8-3297	sticky is similar to moist
1949	1	fbee-1879-a1dc-7106	Louis Pasteur created ; invented pasteurization
1950	1	72f9-9ce2-3aae-5fc6	a nest is made of branches
1951	1	f402-34bf-e178-2a72	staying cool is the opposite of becoming hot
1952	1	43bf-25d8-a9a1-8d90	food spoiling has a negative impact on the health of the animal that eats that food
1953	1	8848-4ca5-92b5-6607	walking is a kind of motion
1954	1	ef33-d8a6-2168-2d74	being stronger usually has a positive impact on an organism 's ; living thing 's health
1955	1	d9e7-bba2-e42c-95af	a prong is a kind of object
1956	1	e3f1-e16c-dd80-32ea	hearing is a kind of sense
1957	1	11e0-b0f3-137d-951c	Vitamin D strengthens ; heals bones
1958	1	d6fc-5f39-b200-7600	Hawaii is located far from the United States mainland
1959	1	b0ba-81fa-58f4-a81b	light years ( ly ) are a unit used for measuring length ; distance generally used for values between 1 and 27000000000
1960	1	03de-d7d0-b5a6-e027	swimming is a kind of skill
1961	1	3a89-10f2-0ff2-f54c	smell is a property of an object ; a material ; a substance
1962	1	0654-00a0-45fb-b306	soft is a kind of hardness
1963	1	765b-d080-8cd8-7a98	thunder occurs during thunderstorms
1964	1	a395-cfde-0f24-1823	an egg requires warmth to survive ; hatch ; develop
1965	1	34ab-0980-7a15-537e	a cavern is a kind of land form
1966	1	bef3-e1f3-4609-53c2	a starling is a kind of bird
1967	1	402e-1817-1d04-e00f	tuna is a kind of fish
1968	1	7740-696e-1fd8-35b8	a compost pile is used for recycling plants
1969	1	37e1-5b9e-00a1-5e21	combining two substances chemically causes chemical reactions
1970	1	f3f1-5a52-e200-585a	controlling the amount of pollution is similar to reducing the amount of pollution
1971	1	b62f-8dfd-e486-3a96	a source of heat can be used to heat something
1972	1	643f-7227-2e92-b2b1	to belong to a group means to be a kind of something
1973	1	94f4-e876-d801-c20c	a panther is a kind of predator
1974	1	0b32-125c-d57c-a9fb	air pressure is a property of air ; the atmosphere
1975	1	eb11-ce60-5982-6b34	a seismograph is used for measuring the size of an earthquake
1976	1	4dc0-19c7-104a-0ddf	both means two
1977	1	fd56-73df-1f6f-e1bc	exercise means physical fitness
1978	1	2fcb-3708-8590-8eee	a mountain ; mountain range is a kind of environment
1979	1	53a9-7d7d-dbcb-98aa	planting trees has a positive impact on an ecosystem
1980	1	fa14-fed7-728a-8147	size is an extensive property
1981	1	c189-3469-1888-aa1f	mixture means solids combined together that maintain their physical properties
1982	1	1076-5022-7c68-9365	reproduction is a kind of process
1983	1	c681-7a3a-3378-eeea	to be made of is similar to collection
1984	1	7663-f110-4072-8d48	an electron is a kind of charged particle
1985	1	6bf8-4a05-d7b7-8bc0	a consumer can not produce its own food
1986	1	d883-1167-2927-a7f7	an organism 's shelter is a part of that organism 's environment
1987	1	9bcc-b632-9e13-d930	as distance to an ocean decreases , the temperature the temperature will decrease
1988	1	5db0-e85b-34b3-b679	sharpening an object causes that object to change shape
1989	1	58fb-4d30-982b-787b	deforested area means an area where trees have been cut down
1990	1	dc88-39d4-99eb-b07d	lightning can cause a forest fire
1991	1	0164-3d03-ab81-9b9a	an eraser is a kind of solid
1992	1	d21d-46cd-1480-2250	a sign of something is evidence of that something
1993	1	5708-ce9b-2605-1881	a stem is used to store water by some plants
1994	1	3240-c2c8-0748-1c2a	down feathers are a kind of material
1995	1	2168-c389-224e-2ee9	elevation relative to sea level is a measure of how high a place is relative to sea level
1996	1	31c9-367f-4e89-4086	arms are a part of a person 's body for manipulating objects
1997	1	6583-a76d-4f3f-b4f0	flammability is a kind of chemical property
1998	1	d8ee-4d4e-e9bb-141e	carrying is similar to conducting
1999	1	e1ae-b51c-1770-3db1	cleaner means less ; lower in pollutants
2000	1	3274-5890-ead5-c376	radiation can affect objects that are not touching
2001	1	0d2a-34ad-e231-a167	the ability to grow is a kind of trait
2002	1	9213-5a66-7733-0fc8	An example of a chemical change is acid breaking down substances
2003	1	4916-83af-ba89-9fc8	a star is made of gases
2004	1	d4a7-ea98-8609-0e2d	a particle is a kind of object
2005	1	b22b-e4b1-9ec5-4b97	topography means the physical features of a planet 's surface
2006	1	f64e-1b60-6e48-9b5a	nervous system is an electrical ; electric conductor
2007	1	5079-3873-b0ab-85a3	an ant is a kind of insect
2008	1	1f6a-7744-7f91-26b5	a tape measure is used to measure length ; distance
2009	1	7eae-fed8-4c36-88aa	an egg is a kind of food
2010	1	0dc5-1599-55c4-d922	a base is basic
2011	1	6a7c-945a-f6fc-9043	a satellite orbits a planet
2012	1	0025-a087-5991-7f66	extreme temperatures cause an organism 's energy levels to decrease
2013	1	d7f6-1eed-ab83-7961	An example of protecting the environment is reducing the amount of waste ; the amount of pollutants
2014	1	2b97-8bcf-ad07-0e9e	appearance is sometimes a physical property
2015	1	e4bc-1333-59ab-707a	wider means greater in width
2016	1	b2a4-7842-5cbe-d717	communication can be used to warn people of dangers
2017	1	371e-0bce-867d-1e1a	a duck is a kind of aquatic animal
2018	1	7532-01eb-475e-acbd	state of matter is a kind of property
2019	1	ead8-a51c-1949-4d56	can means having the ability to
2020	1	9321-c12e-e67d-201b	water is a part of an environment
2021	1	10ea-cf33-c978-c0fb	a clam is a kind of aquatic animal
2022	1	ff69-4994-ef75-6ef3	carbon dioxide concentrations in the air have increased over the last decade dramatically
2023	1	8aaf-28c3-9099-96b9	a swamp is a kind of environment
2024	1	615b-8fca-7958-d93e	the skin is the largest organ in the human body
2025	1	b79e-666e-ccf1-f45c	a cup is a kind of drinking container
