Rank	Frequency	UUID	Row Text
2718	1	4fbb-49e2-aba5-690d	toasting is a kind of cooking
2719	1	3cb8-96f0-34fb-8417	a strip is a kind of object
2720	1	24ed-15e8-f3ce-62a2	solar energy is an inexhaustible resource
2721	1	a887-85b8-05c7-c5e8	a key is a part of a piano
2722	1	3ec5-18c6-fd99-2d5e	when the needle of a compass lines up with Earth 's magnetic poles , the needle points north
2723	1	59a4-b2fa-5937-4f14	to preserve food means to keep fresh food from spoiling
2724	1	de2e-ed32-b721-3787	a desert environment is usually hot in temperature
2725	1	53c9-c71e-2549-c10e	if something lasts longer then that something will not have to be replaced for a long time
2726	1	08a6-a188-ffd9-a822	catching something is synonymous with obtaining that something
2727	1	a70e-aca1-4ca5-67d9	jogging is similar to running
2728	1	6152-0048-10b7-5dd7	electrical insulation requires wrapping a conductor in an insulator
2729	1	76d6-aa20-ec92-1c4a	kilometers ( km ) are a unit used for measuring length ; distance generally used for values between 1 and 50000000
2730	1	3e90-e3f3-440d-008e	condensing is when gasses are cooled below their boiling point
2731	1	a83c-9d85-5625-d525	an acid is acidic
2732	1	bee4-7433-0096-8f52	dropping an object into water causes vibrations in the water
2733	1	521a-5b49-3683-2b01	cutting down trees in a forest causes the number of trees to decrease in that forest
2734	1	2786-3bde-a7de-6181	keeping cool means not increasing temperature
2735	1	0bc0-292e-ad9a-9017	a mother births offspring
2736	1	959c-173d-683c-65a7	to shine means to emit light
2737	1	16ce-a772-1577-f0e3	a fruit is a kind of object
2738	1	ff7d-b137-62ff-567b	a deep sea animal is a kind of marine organism
2739	1	6e3f-b470-4e29-ec6f	to bang means to hit
2740	1	d7fb-3cde-4016-edb4	conserving water can be used for survival in a dry environment
2741	1	6ffc-7a7e-87d9-9732	melting point is a property of a substance ; material
2742	1	ec58-f0e9-1560-01c8	high-quality means positive
2743	1	bf2d-aa23-f737-e69c	cooler means colder
2744	1	d332-396d-4f4f-cda0	mica is a kind of mineral
2745	1	3436-66c9-9e0a-3a8b	to view means to see
2746	1	9020-a34d-342a-2d13	as the supply of food in an environment decreases , the population of animals in that environment will decrease
2747	1	6755-3424-c45b-3c9c	a vegetable is a kind of plant
2748	1	06f4-8004-6e6f-4eab	dew is a kind of liquid
2749	1	2188-2e33-82c8-5741	classifying is a kind of science process
2750	1	bfbd-1a45-3d5c-eb6c	some raccoons live in hollow logs
2751	1	fd17-bb78-344b-3880	when sound reaches the ear , that sound can be heard
2752	1	c946-7dd2-7e3b-c4b7	rattle is a kind of motion
2753	1	1653-a7fe-e9be-42ca	preventing something decreases the amount of that something
2754	1	cdef-3753-0d9d-1e92	boiling means the volume of a liquid decreases
2755	1	26dc-135c-41e9-6a03	eating certain foods is a kind of habit
2756	1	6e34-c92d-1310-8c3a	smell is used for finding food by some animals
2757	1	9b16-01cf-5fdb-ae1e	all minerals are formed by natural geological processes
2758	1	d8c7-2c45-02f6-ba6c	absorbing something from the air means removing that something from Earth 's atmosphere
2759	1	389e-42be-0a2b-0683	a desk usually has a length with values between 50 and 250 cm
2760	1	f7ca-cfe9-d8b4-11a4	An example of an inherited behavior is a bird building a nest
2761	1	cb6d-119e-cb76-09a7	sometimes piles of rock are formed by melting glaciers depositing rocks
2762	1	2523-8171-1306-a08f	if one mineral can scratch another mineral then that other mineral is softer than that one mineral
2763	1	bef6-e915-46ee-d0dd	plants are the source of spices
2764	1	b238-dbf4-7dce-187d	take place means happen
2765	1	3a25-1c51-791f-6ec7	single-cell organism means unicellular organism
2766	1	9615-0fc7-d7f5-487f	a brick is a kind of object
2767	1	159e-ed52-d9e3-76ed	medicine can cause people to have bad reactions
2768	1	86ed-0d8e-531e-34e3	fishing is when a human kills ; catches fish for food
2769	1	6aab-57ff-4d45-9ebf	an animal being born ; being hatched when food is available has a positive impact on that animal 's survival ; health
2770	1	1603-cc51-e120-065e	buoyant means able to float in a liquid or gas
2771	1	274b-e89f-86fa-6446	if a substance is dissolved in another substance then that substance is added to that other substance
2772	1	65b3-3bde-505c-db9e	a hurricane is a kind of storm
2773	1	9b27-4e05-92ed-e884	hydropower requires damming a river
2774	1	933d-6b9a-7b84-d664	freezing point is similar to melting point
2775	1	6778-0a90-bf9d-69c4	transpiration usually happens in the leaves of a plant
2776	1	5082-9c3c-a9c7-f968	deepest means greatest in depth
2777	1	11df-b5ab-f051-1665	wet is the opposite of dry
2778	1	a948-3b4d-ac8c-27e6	sound can be used for communication by animals
2779	1	cf2b-eb3d-dfe5-d6d3	when pollen sticks to a hummingbird , that pollen will move to where the hummingbird moves
2780	1	5295-dcae-6915-29d4	a chipmunk is a kind of mammal
2781	1	2c01-2721-96af-28e1	a deer mouse is a kind of mouse
2782	1	b505-0192-dee3-0797	leaving is a kind of movement
2783	1	402b-f67a-2f5a-0a05	the formation of something is a kind of process
2784	1	3f61-74b3-1327-f313	extreme heat and pressure compact sediment into sedimentary rock
2785	1	a104-d8c9-efec-46be	salt is a kind of solid
2786	1	07e7-551b-7ffc-6aa5	a wire is a kind of path for electricity
2787	1	39c0-522a-11a2-3a53	a fingerprint is small in size
2788	1	ef04-96f5-1898-e701	as available resources increases , the population of an organism that uses those resources will increase
2789	1	8c47-06f1-9f0f-10c4	diameter is a measure of length through the center of a circle
2790	1	e2a9-870f-4d89-e4b8	a cake is a kind of baked product
2791	1	dcf5-861f-9ab6-f238	work is a measure of the product of force and distance
2792	1	b590-a5c1-13d1-7476	car accidents are dangerous
2793	1	74c9-ce13-0e8d-4a29	heat means the transfer of thermal energy
2794	1	f700-0f5f-be06-c22a	shale can be metamorphosed into slate by increased pressure
2795	1	48c6-f72a-6698-6d01	a pulley is used to lift a flag on a flagpole
2796	1	d129-c045-1013-af8c	laying eggs is a kind of property of an animal
2797	1	0d33-7089-468d-fd4b	organisms mean life
2798	1	fb9d-3818-fb1e-48de	refractions of light can be used to help a person see
2799	1	dc30-f318-31e7-5c0b	a scale is a part of a fish
2800	1	df67-2c42-2ea5-500d	touch can be used for detecting texture
2801	1	a462-a04a-e149-ba3f	a lab test on a water supply is used for checking water to make sure it is safe to drink by water companies
2802	1	3e42-533a-ed4d-c99b	covering something is a kind of protection
2803	1	313c-4c5c-0e2c-e2b6	as the speed of an object increases , the force that object exerts will increase
2804	1	e900-125c-4981-68a5	non-contact forces can affect objects that are not touching
2805	1	3944-665a-cd65-c185	plants control the amount of water in their leaves through transpiration
2806	1	35d8-b64d-a726-96c8	a producer is a source of sugar in an ecosystem
2807	1	08c1-496e-6ad5-5c13	bread is a kind of food
2808	1	fba1-b7e2-ae8b-6182	if something is required in a process then obtaining that something is a step in that process
2809	1	7ee2-781c-6f14-a31a	a mouse is a kind of mammal
2810	1	7a02-3c43-f89e-8b50	a beach is a kind of location
2811	1	0c4a-5373-ba1c-b533	a vehicle transmits something
2812	1	123d-8a65-3831-3fa1	crop rotation renews ; protects soil
2813	1	fedb-a67f-5daf-3a1d	intense sound energy can move objects
2814	1	023a-cb3f-47ab-8682	different types of soil have different textures
2815	1	7c13-177b-1402-1e61	a plane travels through the atmosphere
2816	1	520f-4fa4-acef-f45f	dark means dark in color
2817	1	247f-1076-f052-4a42	as distance from a source of light increases , that source of light will appear dimmer
2818	1	7e2e-e161-5c98-444e	erosion causes deposition
2819	1	6aa0-5875-fa94-91e5	jet streams may deflect the air masses moved by the prevailing westerlies
2820	1	68cd-53e7-7adb-0634	a compass is a kind of object
2821	1	aa59-adf0-0e19-8b9e	creating means making
2822	1	d082-bdb2-b20a-30de	to shorten means to make shorter
2823	1	1de2-9254-a03f-38dc	the absorption of oxygen through the blood occurs in the lungs
2824	1	6c0c-f513-3f7d-0aba	a sifter is used for separating mixtures
2825	1	b24f-9ed8-9950-8c23	a beak is used for catching prey by some birds
2826	1	a047-3def-21a6-4a8e	a ship is used for moving people ; products across bodies of water
2827	1	236b-7456-aa80-d1b2	pumice is a kind of igneous rock
2828	1	9a31-6857-9a85-8828	the digestive system is a kind of body system
2829	1	38b9-f9da-56c0-a6bb	pulling away is similar to separating
2830	1	c7d3-bf39-278c-9647	piles of rock are a kind of landform
2831	1	384c-ef0b-e148-70c7	living underground can be used for hiding from predators
2832	1	2ca4-e07e-d662-09c9	gradual means slow
2833	1	359d-9e24-9685-50ca	young amphibians breathe through gills
2834	1	c02e-466c-fe51-440c	found in means existing in
2835	1	ba30-2a8a-fe88-bca0	grouping means putting ; placing in different groups
2836	1	ed29-4e9b-989d-bae0	a sticky tongue is a kind of adaptation for catching insects
2837	1	a505-f059-e395-cad8	electrical current means electrical energy
2838	1	d725-e207-be31-4742	the location of an object can be used to describe that object
2839	1	b0a1-ee71-7d0f-1aab	if two things have the same features then those two things are alike
2840	1	9de6-eb30-5159-2eef	as the number of pollinators attracted to a flower increases , the ability of that flower to reproduce will increase
2841	1	e62c-4993-16db-bb58	something from long ago can be used for studying history
2842	1	c4f6-ee5c-204a-6f07	brick is an electrical ; electrical energy insulator
2843	1	f0c2-63b1-42a5-416b	less is the opposite of more
2844	1	438c-30e7-05f9-eec9	an element is not an alloy
2845	1	4517-3252-bc68-8040	as ability to transport food increases around the world , the available types of food in distant locations will increase
2846	1	2c1e-d35c-e708-676c	a stove is used for cooking by generating heat
2847	1	0ae5-7e63-0d02-bd6a	season is a major yearly temperature change
2848	1	281d-889f-2ea8-3c89	if an animal lives under ground then that animal will be protected from a wild fire
2849	1	73a9-a826-930a-758c	a goose is a kind of bird
2850	1	2c08-7667-3a32-cd76	an earlobe is a kind of body part
2851	1	c7a2-2ef3-cee5-a093	a rainbow is formed by refraction of light by splitting light into all different colors
2852	1	4b4a-63a2-a913-8b18	tidal range is a measure of the vertical distance from high tide to low tide
2853	1	4947-b167-2d68-5a22	as the thickness of something ; of an object increases , the resistance to damage of that object ; of that something will increase
2854	1	f34d-332a-9caa-46f3	UV mean ultraviolet
2855	1	e5ab-6c07-c15d-90f2	seeing requires light
2856	1	2475-8eec-dc25-695b	animals taste flavors
2857	1	1258-c7db-9d8e-88f3	a panel is a kind of object
2858	1	0e17-84f1-a9f9-f27f	detecting is similar to observing
2859	1	1a46-09fd-bf55-7001	adding something is a kind of change
2860	1	d4b6-eb95-4bc2-c80f	high pressure systems cause clear weather
2861	1	1c02-45a8-ac3d-d3e5	a calculator is a kind of tool
2862	1	375c-f58a-32b0-42bf	climbing increases altitude
2863	1	77dc-05da-a205-2af9	shale is a kind of sedimentary rock
2864	1	6c5d-e42d-a164-2888	bone is hard
2865	1	8fe8-675d-6005-472c	some flowers become fruits
2866	1	4f6f-b06b-3c90-bbbd	reptiles lay eggs
2867	1	025a-3b8a-b5f2-f320	crop rotation has a positive impact on soil quality
2868	1	e199-cb9e-c3be-c3de	a flute is a kind of musical instrument
2869	1	541c-2eac-6ed4-ea6a	producing is a kind of function
2870	1	0ef0-7edc-e18e-a2fa	a star is very hot in temperature
2871	1	f06d-9af1-c14f-fb25	people usually only play on the beach when the temperature is hot
2872	1	c21a-180f-0328-7e72	well-suited is similar to adapted
2873	1	90c5-2559-60d6-ec29	a road is a kind of location
2874	1	dc84-e95a-58d3-7e87	raccoons eat trash ; garbage ; waste
2875	1	9ee9-6353-1bca-2fa5	An example of an adaptation is moving fast
2876	1	3686-5795-31e5-b5e0	being in the sun is synonymous with being in the sunlight
2877	1	3518-79e5-2f89-2bc0	friction exerts force on moving objects
2878	1	a6ff-574e-11c6-a86c	reproduction produces offspring
2879	1	5368-ccdf-d870-eae9	a brake is a kind of object
2880	1	3347-b1a5-6757-f53d	to roam means to move to various locations
2881	1	9511-f01b-f849-79ca	a prism is a kind of object
2882	1	ddaf-860d-fe67-ae1e	warning people of something requires knowing about ; predicting that something
2883	1	90a4-4c46-289e-f3e8	saving an organism 's life means preventing the death of that organism
2884	1	7c86-786b-68dd-de35	carpet is a kind of material
2885	1	cc0c-1716-b089-2d07	the ability to reflect off of a surface is a kind of characteristic
2886	1	24ab-b403-fcec-d327	feeders attract animals to a location
2887	1	d5e8-c37b-e2ff-958a	a scratch is a kind of wound
2888	1	cfdd-9d59-af2b-ed66	a wax crayon is made of wax
2889	1	b23c-a7ea-8693-4a44	as the force of gravity increases , the weight of objects will increase
2890	1	7a40-4610-fe1f-42fa	an island is formed by lava being released ; cooling on the ocean floor over time
2891	1	5d96-5bf8-3746-7842	August is during the winter in the southern hemisphere
2892	1	c227-44da-44a9-1d09	the body of a warm-blooded animal is usually warm in temperature
2893	1	f184-e4d0-25d9-d4c7	a poison is a kind of substance
2894	1	1f99-d3ee-86cc-008f	planting native plants has a positive impact on an ecosystem
2895	1	6745-a12f-f936-8192	the formation of rock is a kind of process
2896	1	e838-2f71-4e61-66de	countries are located on the surface of the Earth
2897	1	ad2b-8827-7838-449a	metamorphosis is a kind of process
2898	1	caa8-0bac-3d0b-ba58	drop means decrease
2899	1	7427-b4fb-4ccb-66bb	talc is a kind of mineral
2900	1	53ec-933f-7116-dcaf	to decline means to decrease
2901	1	1f01-c949-a5e3-ab0c	a disperser disperses
2902	1	3125-5f0b-0b90-0577	an threat threatens
2903	1	8754-eb6c-1c85-c80a	to do a job means to perform a job
2904	1	c46f-1a47-b825-6df0	large fins can be used to move quickly through water
2905	1	4af0-b8cd-15fe-0f8d	an electric motor is a part of an electric fan for rotating the vanes in the fan
2906	1	1b14-afc4-9d2b-8dbd	fuel is a kind of energy source
2907	1	bf46-dc46-bf5c-abf5	when light hits a reflective object , that light bounces off that object
2908	1	59cc-fafd-ca02-2f99	a tube-like body has a positive impact on moving through soil
2909	1	33cb-429a-ce86-2d79	humidity is a property of weather and include ordered values of dry ; humid
2910	1	9ea7-0ab4-73cf-d2e1	fishing has a negative impact on ecosystems
2911	1	2ab2-9c07-636c-eaca	sonar is used to find the location of an object
2912	1	356b-17e1-59ba-230b	the nervous system is a part of the body of an animal
2913	1	04a7-76c0-16a3-fbb0	fiber is a kind of material
2914	1	1e59-1be2-a1fb-758e	releasing energy is a kind of function
2915	1	123d-9df4-bf21-0c14	planets have cleared their orbits
2916	1	682c-7e2c-8f66-0543	a polar bear requires a cold environment
2917	1	6bf2-704e-e347-88d8	pulling a plow is a kind of chore
2918	1	9dce-54ac-55cf-f1ed	a rock is usually a solid
2919	1	1d4f-7b26-a32f-d1df	flat means level
2920	1	69bc-91ee-2371-c804	providing something means making ; delivering something
2921	1	d444-1a28-c2ef-6421	natural selection occurs over a period of 1 to many generations which is considered a very long time to a human
2922	1	96a6-5b63-d917-e649	a pot is a kind of object
2923	1	ff5e-bb4f-4d6f-449d	a weather report describes weather
2924	1	349d-dd0e-2deb-7b57	food web is synonymous with food chain
2925	1	50de-3baf-f64e-f3fb	rest has a positive impact on a health
2926	1	9821-0c40-6f55-0b6d	a baby is a kind of young animal
2927	1	0560-dd88-068a-fc05	a mussel is a kind of water animal
2928	1	7bde-6b21-5c29-4e15	one day is equal to 24 hours
2929	1	26f3-c715-9750-2ff7	blacktop means asphalt
2930	1	c323-6873-c26d-4c0b	glaciers cause scratches in rocks
2931	1	3cb0-21ad-9635-ef5c	thawing is similar to melting
2932	1	794a-7ac4-5e27-9d39	steel ; carbon steel is always ferromagnetic ; magnetic
2933	1	ac78-13ef-41eb-82ab	a wrist is a part of the body
2934	1	92e5-34ee-da79-3c25	shape is a property of the appearance of an object
2935	1	004d-1843-0f4a-8ad4	soil is a part of the ground outside
2936	1	83b3-fd83-a8f1-e3f8	favorite means highest preference
2937	1	363a-2bcb-006a-ecd5	the moon rising occurs once per day
2938	1	3e9a-e391-5052-6b55	nutrients are a kind of matter
2939	1	1021-0803-058c-48ef	if studying something is used to learn about something then that something is a source of information
2940	1	8d85-3a9e-2f98-5a9b	density is a measure of mass over volume ; divided by volume
2941	1	93cb-4c9a-59c2-2cd0	a classroom is a kind of a room
2942	1	b32c-707d-1991-3722	if the surface of an object contains something then that object is covered with that something
2943	1	6791-5d18-6261-a488	snow is cold
2944	1	ae9e-abc3-9cb3-216c	the moon is the celestial object that is closest to the Earth
2945	1	4448-2467-9571-5878	to tell the difference between things means to classify those things
2946	1	7bc6-352d-2d67-1ca0	smoking causes direct damage to the lungs
2947	1	7751-b1fd-0582-4f2a	if a plant ; crop requires less water then that plant ; crop will survive in a drought
2948	1	1f93-a702-d4f5-1d46	if something releases something else then that something else decreases in that something
2949	1	8a86-fa7b-a229-2953	fur is a part of a monkey
2950	1	f91b-66ad-cb48-46c6	the nervous system is the vehicle for controlling the body
2951	1	ca30-823e-fdba-2aab	a glove is a kind of tool
2952	1	61ef-2bed-1bb3-4f10	mining changes an ecosystem
2953	1	1b74-b53a-b4ec-5b5f	a screw is a kind of simple machine
2954	1	0d28-3295-e473-c310	mold is a kind of fungus
2955	1	cffe-8f3b-871e-9cfe	when a hibernating frog emergest from mud , that frog has ended its hibernation
2956	1	fa65-d947-a5a2-2d1f	a canyon is a kind of place
2957	1	1368-2e1b-eb74-f182	a field is a kind of habitat
2958	1	0949-9caa-3b15-44cd	legs are usually a part of an animal
2959	1	3958-4821-2eca-d3a9	a deer is a kind of herbivore
2960	1	6a16-9fca-b59e-5353	a centimeter is used for measuring short lengths ; short distances
2961	1	8784-af6f-9679-ba17	limiting something is a kind of activity
2962	1	77f9-749f-9394-ae34	coal is a nonrenewable resource
2963	1	3395-b5a2-ae2d-39c2	substances are made of matter
2964	1	9c09-1905-9028-692b	satellite technology is used for predicting the weather
2965	1	1d29-f8d7-5834-aa6c	grass does not contain wood
2966	1	7e6a-bb5a-c31e-85f2	a tree is a kind of living thing
2967	1	999d-78fd-e16b-a8b6	a seal is a kind of animal
2968	1	3bbf-bcf5-c798-f7e7	earthquakes folding rock layers causes older rock to be on top of younger rock
2969	1	d3e8-b460-93fe-7706	if an animal relies on plants for food then that animal must store enough food to last through the winter
2970	1	afe8-fef7-01ec-6fbb	pushing on the pedals of a bike cause that bike to move
2971	1	f8be-9407-d60e-6282	the sun rising ; setting occurs once per day
2972	1	9c97-5684-21f1-8494	skin is a kind of organ
2973	1	b8bd-0f06-439a-5721	the greenhouse effect is when carbon in the air heats a planet 's atmosphere
2974	1	f50f-d47e-79e8-e25b	corn is a kind of seed
2975	1	f306-b3dc-08d5-67b6	having an impact on something means altering that something
2976	1	a029-482a-dd71-9829	extreme heat and pressure change ; metamorphose rock into metamorphic rock
2977	1	2863-93fe-ff62-7b41	if a mineral can be scratched by a fingernail then that mineral is soft
2978	1	df49-3285-6193-e5f5	if an event occurs by adding something then that event requires that something
2979	1	e70f-e13e-37af-1fda	dimmer means less bright
2980	1	552c-12e5-34a3-40d6	producing light is used for attracting prey by some deep sea animals
2981	1	3e47-33d1-5c3d-ae35	being active requires energy
2982	1	472e-feaf-d532-1ec1	Earth 's magnetic patterns are used for finding locations by animals that migrate
2983	1	d7a4-ff12-2d63-e221	flood plains are located near rivers
2984	1	da8e-d915-e5af-ae29	harm means danger
2985	1	a665-2771-83e8-adb8	freezing point is a property of a substance ; material
2986	1	5298-d80f-5675-6ea3	fish is a kind of meat
2987	1	4b40-ee0e-7e5d-23f3	role is similar to importance
2988	1	f63b-aef7-81b2-c372	pluto has not cleared its orbit
2989	1	1a29-2268-eeb7-edba	the moon orbiting the Earth approximately occurs 13 times per year
2990	1	dde9-e2a5-57aa-acdc	a bird is warm-blooded
2991	1	cf2f-78eb-312b-8a6f	burning wood is used to produce heat
2992	1	cfb3-f3ae-f0d8-b6ca	plants are the source of fruit
2993	1	df44-1d34-37d8-5123	natural resources are found in nature
2994	1	f3c5-da85-408b-e3f5	preserved means from the past ; from long ago
2995	1	4134-b88a-654b-1cf3	tuna eat fish
2996	1	eb58-30d7-0fc1-e38a	survive means live
2997	1	c561-260c-558d-89b4	a fish is a kind of predator
2998	1	9d6c-c552-fb86-cb2b	lighter means lower ; less in weight
2999	1	1065-849d-5c96-0863	a coastal area is a kind of environment
3000	1	c003-e5f0-d0c5-e922	performing lab expiriments accurately requires reading ; understanding all directions beforehand
3001	1	587b-cf2b-5466-f25a	if two equal forces in opposite directions act on an object then that object will stay in the same place
3002	1	65b3-196a-be1f-b9be	a meter is a kind of unit for measuring distance ; measuring length
3003	1	f4f1-8d09-36bb-8db5	if an animal 's skin looks like something then that animal looks like that something
3004	1	a094-21de-59c0-f3ad	all living things have life cycles
3005	1	dba6-6a33-ccd7-4653	fins are a part of aquatic animals used for moving through water
3006	1	ecca-9a1d-3074-cd00	higher means greater ; above in value ; amount ; number
3007	1	35de-03a6-5a5e-50e6	the type of material through which sound passes changes the speed at which sound travels
3008	1	39b0-792c-8e27-6758	magnetic attraction pulls two objects together
3009	1	5ed4-1803-24c0-ee4b	fragrance means smell
3010	1	16ea-bfa4-07c6-c55d	cure means solution to being sick
3011	1	7717-15e3-f50d-464a	answering questions requires information
3012	1	57c5-f27f-1d68-9a7a	using less of a resource increases the availability of that resource
3013	1	4822-2d16-dd11-2f6f	sweat is used for adjusting to hot temperatures by some animals
3014	1	689c-8e64-fe48-c90e	An example of replacing a natural resource is planting new trees where a forest once stood
3015	1	b9f5-6d14-f72a-e2d8	intensity of sunlight is similar to amount of sunlight
3016	1	0057-a547-0990-9dc8	Rachel is a name for a human
3017	1	ef7d-a3f3-6200-ea1d	coal mine is a source of coal under the ground
3018	1	2dfb-6788-d488-9db9	sleet is made of ice
3019	1	df77-f13b-3062-2718	a computer controls a robot
3020	1	b5bc-352e-4a8b-390a	an enemy is a threat
3021	1	378e-3052-e593-d80f	underwater means below water
3022	1	a5c9-d7a4-8421-bb2e	a telephone is used for communication by humans over long distances
3023	1	450b-d1e6-d7b9-2e6b	developing means creating ; inventing
3024	1	ef15-b075-f83c-0d12	a learned characteristic is a kind of acquired characteristic
3025	1	9ed6-4e8f-abab-588b	the sun setting is a kind of event
3026	1	8e36-e48b-2059-4d7e	when a habitat can support living things , living things can live in that habitat
3027	1	4893-838a-20f6-131a	performing a task in less time ; more quickly ; faster has a positive impact on a person 's life
3028	1	e470-cbe8-086a-5af9	nectar is used for attracting pollinators by plants
3029	1	58d8-a151-b408-ed86	a woodpecker is a kind of bird
3030	1	599c-ede6-83d2-982c	race is when vehicles ; humans compete
3031	1	9ebc-df4f-9e45-4e81	weed is a kind of plant
3032	1	24a0-6fbe-c3ae-d6ee	investigating the life cycle of a living thing requires that living thing to be alive
3033	1	4102-0f86-9ded-c9db	popping popcorn requires adding heat
3034	1	c56e-40f5-5a3e-12cf	lightning is a kind of electricity
3035	1	5c99-06b6-7e1e-f150	rocks sometimes contain aluminum
3036	1	7f82-8a0b-a3e0-26c5	having a variety of foods available has a positive impact on people 's lives
3037	1	e58d-03a1-b94d-942d	a forest is a kind of ecosystem
3038	1	d08f-9cae-ad54-80ed	lead is a kind of element
3039	1	c709-83dd-975c-b05d	carnivores ; omnivores ; herbivores are a kind of animal
3040	1	bfb3-7ce9-4ba1-f302	as ability to preserve food increases , the ability to transport food increases
3041	1	a5ab-7b37-388a-1cd3	a burner is a kind of object ; surface
3042	1	beff-ff71-8de4-ab6c	if it is night then the sun has set
3043	1	d11b-6226-0d28-588a	role means function
3044	1	fc7f-85ca-56d1-d7d5	June is during the winter in the southern hemisphere
3045	1	3aee-f557-db87-1cce	a poisonous animal is dangerous
3046	1	9dc0-0ba6-dbb6-4ff7	an animal 's shell is usually hard for protection
3047	1	9d4d-3bfb-e0e2-d068	as distance from an object decreases , the the pull of gravity on that object increases
3048	1	a183-80da-46fa-bfa6	largest means greatest in size
3049	1	5404-b04d-d0b2-6309	dissolving is similar to breaking down
3050	1	e83b-d62e-d528-3e9f	a battery converts chemical energy into electrical energy
3051	1	e7b5-57e9-5c3c-fe3e	An example of moisture is water vapor in the atmosphere
3052	1	02c9-a481-d0f4-91e2	a tire is a kind of object
3053	1	628f-08c3-a230-9bfb	shrinking decreases size
3054	1	6082-9118-c751-6e77	the continental shelf is made of sediment
3055	1	b743-7f87-6ef1-0c33	absorbing is similar to obtaining
3056	1	5779-3c33-cd1f-22be	if something has a negative impact on something else then increasing the amount of that something has a negative impact on that something else
3057	1	735e-0af2-549d-a69a	tearing an object changes that object 's shape
3058	1	a0cd-50c8-3696-fc4b	a moon is a kind of satellite
3059	1	e9c2-0dff-cd9a-7fb0	phloem transports materials through the plant
3060	1	02bb-bdf2-f936-d557	cooking is a kind of skill for preparing food
